A1: A - Absence | B1: One point was deducted for each missed lecture, which means two for each missed meeting.
A2: B - Bonuses | B2: Total bonuses. Note that a 5% for the major lecture means 2.5 points for the final grade, since the major lecture is 50% of the entire course's grade.

A1: T - Timing | B1: Using the full hour, arriving on time, splitting time between speakers, submitting the written parts on time.
A2: P - Presentation | B2: The PowerPoint presentation: Logical order of things, clarity, use of graphical aids.
A3: S - Speech | B3: Explaining the material well, attracting and controlling the audience, focusing on the key features of the technology.
A4: K - Knowledge | B4: Deep understanding of the material, answering questions, level of depth and lecture.
A5: E - Examples | B5: The quality, clarity and originality of the two demos.

A1: C - Coverage | B1: Covering all important aspects well, evidence of thorough study, providing good links.
A2: W - Writing | B2: Clarity, Logical order and depth of explanation, and the level of the demo.

A1: R - Range of Technologies | B1: Number of technologies and non-trivial issues learnt and used.
A2: D - Difficulty | B2: Technical complexity of implementing the project, taking into account using beta software, unavailability of documentation or debuggers, enormous coding, etc.
A3: U - Usability | B3: Documentation, clear explanations, installation instructions, references and anything else which will help others learn the technology starting from your project.

B2: ID | C2: A | D2: B | E2: T | F2: P | G2: S | H2: K | I2: E | J2: C | K2: W | L2: R | M2: D | N2: U | O2: Final
B3: 38232243 | C3: -2 | D3: 2.5 | E3: 7 | F3: 8 | G3: 9 | H3: 9 | I3: 9 | J3: 10 | K3: 10 | L3: 9 | M3: 9 | N3: 10 | O3: =CEILING(SUM(C3:N3),1) -> 91
B4: 33229675 | C4: -4 | D4: 7.5 | E4: 10 | F4: 10 | G4: 9 | H4: 10 | I4: 10 | J4: 10 | K4: 9 | L4: 9 | M4: 9 | N4: 10 | O4: =CEILING(SUM(C4:N4),1) -> 100
B5: 33120049 | D5: 6 | E5: 8 | F5: 10 | G5: 10 | H5: 10 | I5: 10 | J5: 10 | K5: 10 | L5: 9 | M5: 10 | N5: 7 | O5: =CEILING(SUM(C5:N5),1) -> 100
B6: 32288607 | D6: 2.5 | E6: 8 | F6: 10 | G6: 10 | H6: 10 | I6: 9 | J6: 9 | K6: 9 | L6: 9 | M6: 9 | N6: 10 | O6: =CEILING(SUM(C6:N6),1) -> 96
B7: 38786679 | D7: 1 | E7: 10 | F7: 10 | G7: 9 | H7: 10 | I7: 10 | J7: 10 | K7: 10 | L7: 10 | M7: 10 | N7: 10 | O7: =CEILING(SUM(C7:N7),1) -> 100
B8: 387892461 | C8: -2 | E8: 8 | F8: 10 | G8: 9 | H8: 10 | I8: 10 | J8: 10 | K8: 10 | L8: 10 | M8: 9 | N8: 9 | O8: =CEILING(SUM(C8:N8),1) -> 93
B9: 32288805 | C9: -3 | E9: 10 | F9: 10 | G9: 10 | H9: 10 | I9: 10 | J9: 10 | K9: 10 | L9: 9 | M9: 10 | N9: 10 | O9: =CEILING(SUM(C9:N9),1) -> 96
B10: 28131795 | C10: -2 | D10: 2.5 | E10: 10 | F10: 10 | G10: 10 | H10: 10 | I10: 10 | J10: 10 | K10: 10 | L10: 9 | M10: 9 | N10: 9 | O10: =CEILING(SUM(C10:N10),1) -> 98
B11: 25735812 | C11: -4 | E11: 10 | F11: 10 | G11: 10 | H11: 10 | I11: 10 | J11: 10 | K11: 10 | O11: =CEILING(SUM(C11:N11),1) -> 66
B12: 37665304 | C12: -2 | E12: 10 | F12: 8 | G12: 9 | H12: 10 | I12: 9 | J12: 10 | K12: 9 | L12: 9 | M12: 10 | N12: 10 | O12: =CEILING(SUM(C12:N12),1) -> 92
B13: 33373853 | E13: 10 | F13: 8 | G13: 9 | H13: 8 | I13: 10 | J13: 7 | K13: 9 | L13: 9 | M13: 9 | N13: 10 | O13: =CEILING(SUM(C13:N13),1) -> 89
B14: 32283236 | E14: 10 | F14: 7 | G14: 8 | H14: 9 | I14: 10 | J14: 9 | K14: 10 | L14: 8 | M14: 10 | N14: 10 | O14: =CEILING(SUM(C14:N14),1) -> 91
B15: 38265450 | C15: -1 | E15: 10 | F15: 10 | G15: 10 | H15: 10 | I15: 10 | J15: 10 | K15: 10 | L15: 9 | M15: 10 | N15: 10 | O15: =CEILING(SUM(C15:N15),1) -> 98
B16: 310297114 | D16: 5 | E16: 10 | F16: 7 | G16: 9 | H16: 10 | I16: 10 | J16: 10 | K16: 10 | O16: =CEILING(SUM(C16:N16),1) -> 71
B17: 32087660 | C17: -1 | D17: 2.5 | E17: 8 | F17: 9 | G17: 10 | H17: 10 | I17: 10 | J17: 9 | K17: 9 | L17: 10 | M17: 10 | N17: 10 | O17: =CEILING(SUM(C17:N17),1) -> 97
B18: 32080707 | C18: -2 | E18: 9 | F18: 8 | G18: 8 | H18: 9 | J18: 9 | K18: 9 | O18: =CEILING(SUM(C18:N18),1) -> 50
B19: 31578578 | C19: -2 | D19: 2.5 | E19: 8 | F19: 7 | G19: 8 | H19: 9 | J19: 9 | K19: 9 | O19: =CEILING(SUM(C19:N19),1) -> 51
B20: 33227141 | E20: 10 | F20: 9 | G20: 9 | H20: 7 | I20: 9 | J20: 10 | K20: 10 | L20: 10 | M20: 9 | N20: 10 | O20: =CEILING(SUM(C20:N20),1) -> 93
B21: 33293499 | C21: -4 | E21: 10 | F21: 10 | G21: 10 | H21: 10 | I21: 10 | J21: 10 | K21: 10 | L21: 7 | M21: 8 | N21: 9 | O21: =CEILING(SUM(C21:N21),1) -> 90
B22: 29484201 | D22: 2.5 | E22: 7 | F22: 9 | G22: 9 | H22: 7 | I22: 9 | J22: 10 | K22: 10 | L22: 9 | M22: 8 | N22: 10 | O22: =CEILING(SUM(C22:N22),1) -> 91
B23: 32418428 | D23: 1 | E23: 10 | F23: 10 | G23: 10 | H23: 10 | I23: 10 | J23: 10 | K23: 10 | L23: 9 | M23: 10 | N23: 10 | O23: =CEILING(SUM(C23:N23),1) -> 100
B24: 15948391 | D24: 6 | E24: 8 | F24: 10 | G24: 10 | H24: 10 | I24: 10 | J24: 10 | K24: 10 | L24: 9 | M24: 10 | N24: 7 | O24: =CEILING(SUM(C24:N24),1) -> 100
B25: 38274833 | C25: -2 | D25: 7.5 | E25: 10 | F25: 10 | G25: 9 | H25: 10 | I25: 10 | J25: 10 | K25: 9 | L25: 9 | M25: 9 | N25: 10 | O25: =CEILING(SUM(C25:N25),1) -> 102
B26: 29508298 | C26: -4 | E26: 9 | F26: 9 | G26: 7 | H26: 10 | I26: 7 | J26: 10 | K26: 9 | L26: 8 | M26: 9 | N26: 8 | O26: =CEILING(SUM(C26:N26),1) -> 82
B27: 31958648 | C27: -2 | D27: 2.5 | E27: 7 | F27: 9 | G27: 9 | H27: 7 | I27: 9 | J27: 10 | K27: 10 | L27: 9 | M27: 8 | N27: 10 | O27: =CEILING(SUM(C27:N27),1) -> 89
B28: 38886578 | C28: -1 | D28: 2.5 | E28: 8 | F28: 7 | G28: 8 | H28: 9 | I28: 9 | J28: 9 | K28: 9 | L28: 9 | M28: 8 | N28: 9 | O28: =CEILING(SUM(C28:N28),1) -> 87
B29: 314058645 | D29: 2.5 | E29: 10 | F29: 9 | G29: 9 | H29: 10 | I29: 10 | J29: 9 | K29: 10 | L29: 10 | M29: 10 | N29: 10 | O29: =CEILING(SUM(C29:N29),1) -> 100
B30: 38425112 | C30: -2 | E30: 7 | F30: 10 | G30: 7 | H30: 9 | I30: 9 | J30: 10 | K30: 10 | L30: 9 | M30: 10 | N30: 9 | O30: =CEILING(SUM(C30:N30),1) -> 88
B31: 32276750 | E31: 10 | F31: 7 | G31: 9 | H31: 7 | I31: 10 | J31: 10 | K31: 10 | O31: =CEILING(SUM(C31:N31),1) -> 63
B32: 38239000 | C32: -14 | E32: 9 | F32: 8 | G32: 8 | H32: 9 | O32: =CEILING(SUM(C32:N32),1) -> 20
B33: 33226911 | D33: 2.5 | E33: 7 | F33: 9 | G33: 9 | H33: 7 | I33: 9 | J33: 10 | K33: 10 | L33: 9 | M33: 8 | N33: 10 | O33: =CEILING(SUM(C33:N33),1) -> 91
B34: 33675711 | E34: 10 | F34: 7 | G34: 7 | H34: 10 | I34: 10 | J34: 9 | K34: 10 | O34: =CEILING(SUM(C34:N34),1) -> 63
B35: 31936172 | D35: 2.5 | E35: 10 | F35: 10 | G35: 10 | H35: 10 | I35: 10 | J35: 10 | K35: 10 | L35: 9 | M35: 9 | N35: 9 | O35: =CEILING(SUM(C35:N35),1) -> 100
B36: 25109307 | C36: -2 | E36: 10 | F36: 7 | G36: 8 | H36: 10 | I36: 10 | J36: 10 | K36: 10 | L36: 9 | M36: 9 | N36: 9 | O36: =CEILING(SUM(C36:N36),1) -> 90
B37: 11764735 | D37: 2.5 | E37: 10 | F37: 10 | G37: 10 | H37: 10 | I37: 10 | J37: 10 | K37: 10 | L37: 9 | M37: 9 | N37: 9 | O37: =CEILING(SUM(C37:N37),1) -> 100
B38: 32428476 | E38: 10 | F38: 9 | G38: 9 | H38: 10 | I38: 9 | J38: 9 | K38: 10 | L38: 10 | M38: 9 | N38: 10 | O38: =CEILING(SUM(C38:N38),1) -> 95
B39: 32085417 | E39: 10 | F39: 9 | G39: 9 | H39: 10 | I39: 9 | J39: 9 | K39: 10 | L39: 10 | M39: 9 | N39: 10 | O39: =CEILING(SUM(C39:N39),1) -> 95
B40: 306932161 | E40: 10 | F40: 10 | G40: 10 | H40: 10 | I40: 10 | J40: 10 | K40: 10 | L40: 7 | M40: 8 | N40: 9 | O40: =CEILING(SUM(C40:N40),1) -> 94
B41: 38793691 | C41: -2 | E41: 10 | F41: 8 | G41: 8 | H41: 10 | I41: 9 | J41: 8 | K41: 9 | L41: 10 | M41: 10 | N41: 9 | O41: =CEILING(SUM(C41:N41),1) -> 89
B42: 38235636 | E42: 10 | F42: 8 | G42: 8 | H42: 10 | I42: 9 | J42: 8 | K42: 9 | L42: 10 | M42: 10 | N42: 9 | O42: =CEILING(SUM(C42:N42),1) -> 91
B43: 33225384 | D43: 1 | E43: 10 | F43: 10 | G43: 9 | H43: 10 | I43: 10 | J43: 10 | K43: 10 | L43: 10 | M43: 10 | N43: 10 | O43: =CEILING(SUM(C43:N43),1) -> 100
B44: 38235503 | C44: -2 | D44: 7.5 | E44: 10 | F44: 10 | G44: 9 | H44: 10 | I44: 10 | J44: 10 | K44: 9 | L44: 9 | M44: 9 | N44: 10 | O44: =CEILING(SUM(C44:N44),1) -> 102
B45: 33468836 | C45: -4 | E45: 7 | F45: 10 | G45: 7 | H45: 9 | I45: 9 | J45: 10 | K45: 10 | L45: 9 | M45: 10 | N45: 9 | O45: =CEILING(SUM(C45:N45),1) -> 86
B46: 304136674 | C46: -2 | D46: 2.5 | E46: 8 | F46: 7 | G46: 8 | H46: 9 | I46: 9 | J46: 9 | K46: 9 | L46: 7 | M46: 8 | N46: 9 | O46: =CEILING(SUM(C46:N46),1) -> 84
B47: 28781128 | E47: 10 | F47: 8 | G47: 8 | H47: 10 | I47: 9 | J47: 8 | K47: 9 | L47: 10 | M47: 10 | N47: 9 | O47: =CEILING(SUM(C47:N47),1) -> 91
B48: 38273488 | C48: -4 | E48: 7 | F48: 10 | G48: 7 | H48: 9 | I48: 9 | J48: 10 | K48: 10 | L48: 9 | M48: 10 | N48: 9 | O48: =CEILING(SUM(C48:N48),1) -> 86
B49: 17331455 | E49: 10 | F49: 10 | G49: 9 | H49: 10 | I49: 10 | J49: 10 | K49: 10 | L49: 8 | M49: 8 | N49: 10 | O49: =CEILING(SUM(C49:N49),1) -> 95
B50: 33324567 | C50: -2 | E50: 10 | F50: 7 | G50: 7 | H50: 10 | I50: 10 | J50: 9 | K50: 10 | O50: =CEILING(SUM(C50:N50),1) -> 61
B51: 33961384 | D51: 2.5 | E51: 10 | F51: 9 | G51: 9 | H51: 10 | I51: 10 | J51: 9 | K51: 10 | L51: 10 | M51: 10 | N51: 10 | O51: =CEILING(SUM(C51:N51),1) -> 100
B52: 3207564 | C52: -2 | E52: 6 | F52: 8 | G52: 10 | H52: 9 | I52: 10 | J52: 10 | K52: 9 | L52: 9 | M52: 8 | N52: 9 | O52: =CEILING(SUM(C52:N52),1) -> 86
B53: 25551417 | D53: 2.5 | E53: 8 | F53: 10 | G53: 10 | H53: 10 | I53: 9 | J53: 9 | K53: 9 | L53: 9 | M53: 9 | N53: 10 | O53: =CEILING(SUM(C53:N53),1) -> 96
B54: 32284648 | E54: 10 | F54: 7 | G54: 8 | H54: 9 | I54: 10 | J54: 9 | K54: 10 | L54: 8 | M54: 10 | N54: 10 | O54: =CEILING(SUM(C54:N54),1) -> 91
B55: 32077265 | E55: 6 | F55: 8 | G55: 10 | H55: 9 | I55: 10 | J55: 10 | K55: 9 | L55: 9 | M55: 8 | N55: 9 | O55: =CEILING(SUM(C55:N55),1) -> 88
B56: 32454498 | D56: 1 | E56: 10 | F56: 10 | G56: 9 | H56: 10 | I56: 10 | J56: 10 | K56: 10 | L56: 10 | M56: 10 | N56: 10 | O56: =CEILING(SUM(C56:N56),1) -> 100
B57: 313643173 | D57: 5 | E57: 10 | F57: 7 | G57: 9 | H57: 10 | I57: 10 | J57: 10 | K57: 10 | O57: =CEILING(SUM(C57:N57),1) -> 71
B58: 38268710 | E58: 10 | F58: 7 | G58: 7 | H58: 10 | I58: 10 | J58: 9 | K58: 10 | O58: =CEILING(SUM(C58:N58),1) -> 63
B59: 25623729 | E59: 8 | F59: 10 | G59: 9 | H59: 10 | I59: 10 | J59: 10 | K59: 10 | L59: 10 | M59: 9 | N59: 9 | O59: =CEILING(SUM(C59:N59),1) -> 95
B60: 32283087 | E60: 10 | F60: 8 | G60: 9 | H60: 8 | I60: 10 | J60: 7 | K60: 9 | L60: 9 | M60: 9 | N60: 10 | O60: =CEILING(SUM(C60:N60),1) -> 89
B61: 32084501 | C61: -4 | E61: 10 | F61: 10 | G61: 10 | H61: 10 | I61: 10 | J61: 10 | K61: 10 | O61: =CEILING(SUM(C61:N61),1) -> 66
B62: 303719066 | C62: -2 | E62: 10 | F62: 8 | G62: 8 | H62: 10 | I62: 10 | J62: 10 | K62: 10 | L62: 9 | M62: 9 | N62: 10 | O62: =CEILING(SUM(C62:N62),1) -> 92
B63: 33509431 | D63: 2.5 | E63: 7 | F63: 8 | G63: 9 | H63: 9 | I63: 9 | J63: 10 | K63: 10 | L63: 9 | M63: 9 | N63: 10 | O63: =CEILING(SUM(C63:N63),1) -> 93
B64: 32273674 | C64: -4 | E64: 9 | F64: 9 | G64: 7 | H64: 10 | I64: 7 | J64: 10 | K64: 9 | L64: 8 | M64: 9 | N64: 8 | O64: =CEILING(SUM(C64:N64),1) -> 82
B65: 32073900 | E65: 10 | F65: 8 | G65: 8 | H65: 10 | I65: 10 | J65: 10 | K65: 10 | L65: 9 | M65: 9 | N65: 10 | O65: =CEILING(SUM(C65:N65),1) -> 94
B66: 11840147 | E66: 10 | F66: 10 | G66: 9 | H66: 10 | I66: 10 | J66: 10 | K66: 10 | L66: 8 | M66: 8 | N66: 10 | O66: =CEILING(SUM(C66:N66),1) -> 95
B67: 302082672 | D67: 2.5 | E67: 7 | F67: 8 | G67: 9 | H67: 9 | I67: 9 | J67: 10 | K67: 10 | L67: 9 | M67: 9 | N67: 10 | O67: =CEILING(SUM(C67:N67),1) -> 93
B68: 38793535 | E68: 10 | F68: 7 | G68: 9 | H68: 7 | I68: 10 | J68: 10 | K68: 10 | O68: =CEILING(SUM(C68:N68),1) -> 63
B69: 313719544 | C69: -2 | E69: 10 | F69: 9 | G69: 9 | H69: 10 | I69: 10 | J69: 10 | K69: 10 | O69: =CEILING(SUM(C69:N69),1) -> 66
B70: 29327053 | E70: 10 | F70: 7 | G70: 9 | H70: 7 | I70: 10 | J70: 10 | K70: 10 | O70: =CEILING(SUM(C70:N70),1) -> 63
B71: 32063604 | E71: 10 | F71: 8 | G71: 9 | H71: 8 | I71: 10 | J71: 9 | K71: 10 | L71: 10 | M71: 10 | N71: 10 | O71: =CEILING(SUM(C71:N71),1) -> 94
B72: 32452831 | C72: -2 | E72: 10 | F72: 8 | G72: 9 | H72: 10 | I72: 9 | J72: 10 | K72: 9 | L72: 9 | M72: 10 | N72: 10 | O72: =CEILING(SUM(C72:N72),1) -> 92
B73: 32279523 | E73: 10 | F73: 9 | G73: 9 | H73: 7 | I73: 9 | J73: 10 | K73: 10 | L73: 10 | M73: 9 | N73: 10 | O73: =CEILING(SUM(C73:N73),1) -> 93
B74: 27437839 | C74: -4 | D74: 2.5 | E74: 8 | F74: 9 | G74: 10 | H74: 10 | I74: 10 | J74: 9 | K74: 9 | L74: 10 | M74: 10 | N74: 10 | O74: =CEILING(SUM(C74:N74),1) -> 94
B75: 34921858 | C75: -10 | E75: 10 | F75: 8 | G75: 8 | H75: 10 | I75: 10 | J75: 10 | K75: 10 | L75: 9 | M75: 9 | N75: 10 | O75: =CEILING(SUM(C75:N75),1) -> 84
B76: 33944687 | D76: 6 | E76: 8 | F76: 10 | G76: 10 | H76: 10 | I76: 10 | J76: 10 | K76: 10 | L76: 9 | M76: 10 | N76: 7 | O76: =CEILING(SUM(C76:N76),1) -> 100
B77: 32458218 | E77: 10 | F77: 9 | G77: 9 | H77: 10 | I77: 9 | J77: 9 | K77: 10 | L77: 10 | M77: 9 | N77: 10 | O77: =CEILING(SUM(C77:N77),1) -> 95
B78: 31797582 | E78: 10 | F78: 7 | G78: 8 | H78: 10 | I78: 10 | J78: 10 | K78: 10 | L78: 9 | M78: 9 | N78: 9 | O78: =CEILING(SUM(C78:N78),1) -> 92
B79: 25437344 | C79: -2 | E79: 9 | F79: 8 | G79: 8 | H79: 9 | J79: 9 | K79: 9 | O79: =CEILING(SUM(C79:N79),1) -> 50
B80: 32276438 | E80: 10 | F80: 7 | G80: 8 | H80: 10 | I80: 10 | J80: 10 | K80: 10 | L80: 9 | M80: 9 | N80: 9 | O80: =CEILING(SUM(C80:N80),1) -> 92
B82: Average | C82: =AVERAGE(C3:C80) -> -3.0588235294117645 | D82: =AVERAGE(D3:D80) -> 3.3166666666666669 | E82: =AVERAGE(E3:E80) -> 9.1794871794871788 | F82: =AVERAGE(F3:F80) -> 8.7051282051282044 | G82: =AVERAGE(G3:G80) -> 8.8205128205128212 | H82: =AVERAGE(H3:H80) -> 9.4102564102564106 | I82: =AVERAGE(I3:I80) -> 9.6081081081081088 | J82: =AVERAGE(J3:J80) -> 9.5844155844155843 | K82: =AVERAGE(K3:K80) -> 9.7012987012987004 | L82: =AVERAGE(L3:L80) -> 9.0952380952380949 | M82: =AVERAGE(M3:M80) -> 9.2063492063492056 | N82: =AVERAGE(N3:N80) -> 9.4761904761904763 | O82: =AVERAGE(O3:O80) -> 86.782051282051285